Flow path,Development path,Development driver,Option name,Augmentation description,Pre-requisite options,Forward direction power flow,"Notional transfer level increase (MW) Note: Same increase applies to all transfer limit conditions (Peak demand, Summer typical and Winter reference)_Forward direction","Notional transfer level increase (MW) Note: Same increase applies to all transfer limit conditions (Peak demand, Summer typical and Winter reference)_Reverse direction","Indicative cost estimate ($2025, $ million)",Cost estimate source,Cost estimate class,Easement length (km),Lead time or earliest in service date,Additional REZ transmission capacity provided,Notes
SQ-CQ,West of the existing SQ-CQ path,Increase transfer capability between SQ and CQ.,SQ-CQ Option 1,• A new 275 kV double-circuit line between Calvale and Wandoan South • 275 kV line shunt reactors at both ends of Calvale to Wandoan South 275 kV circuits,• A new 275 kV double-circuit line between Calvale and Wandoan South • 275 kV line shunt reactors at both ends of Calvale to Wandoan South 275 kV circuits,SQ to CQ,900,900,1323.4198245291,AEMO TCD,Class 5b(±50%),247,Long: (9 years),Long: (9 years),Long: (9 years)
SQ-CQ,Existing SQ-CQ path,Increase transfer capability between SQ-CQ. Mid-point (Auburn River) switching substation.,SQ-CQ Option 2,• Mid-point switching substation (Auburn River) on the existing Calvale to Halys 275 kV double-circuit line,• Mid-point switching substation (Auburn River) on the existing Calvale to Halys 275 kV double-circuit line,SQ to CQ,0,300,59.149628750194,AEMO TCD,Class 5b(±50%),0,Short: (5 years),Short: (5 years),Short: (5 years)
SQ-CQ,Existing SQ-CQ path (500 kV operating at 275 kV),Increase transfer capability between SQ and CQ. Staging of the Queensland SuperGrid South project by building new 500 kV lines which operate at 275 kV.,SQ-CQ Option 3,"• A new 500 kV double circuit line between mid-point (Auburn River) and Calvale substations, operating at 275 kV. • A new 500 kV double circuit line between mid-point (Auburn River) and Halys substations, operating at 275 kV. • A new 500 kV double circuit line between Cavale and Gladstone West (CQ) 275 kV substations, operating at 275 kV",SQ-CQ Option 2 and CQ-GG Option 2,SQ to CQ,2800,1400,3177.1338216986,AEMO TCD,Class 5b(±50%),366,Long: (10 years),Long: (10 years),Long: (10 years)
SQ-CQ,Existing SQ-CQ path,Increase transfer capability between SQ and CQ. Non-network option.,SQ-CQ Option 4,• Non-network option – virtual transmission line option with a 300 MW energy storage system north of Calvale and south of Halys,• Non-network option – virtual transmission line option with a 300 MW energy storage system north of Calvale and south of Halys,SQ to CQ,300,300,300.0,300,300,0,Short: (3 years),Short: (3 years),Short: (3 years)
SQ-CQ,Existing SQ-CQ path,Increase transfer capability between SQ and CQ. Queensland SuperGrid South project.,SQ-CQ Option 5,• New 500 kV double-circuit line between Halys and Auburn River substations • New 500 kV double-circuit line between Auburn River and Gladstone West substations • Establish 500 KV Halys substation with 3 x 500/275 kV 1500 MVA transformers • New 500 kV substation west of Gladstone (CQ 500 kV substation) with 3 x 500/275 kV 1500 MVA transformers • Establish 500 kV substation at Auburn River with 2 x 500/275kV 1500 MVA transformers • New dynamic reactive support at Gladstone West (CQ) substation,"SQ-CQ Option 2, CQ-GG Option 2",SQ to CQ,3150,1900,3751.4172,AEMO TCD,Class 5b(±50%),331,Long: (10 years),Q7 Hydrogen: 950,Q7 Hydrogen: 950
SQ-CQ,Existing SQ-CQ path (operating at 500 kV),Staging the Queensland SuperGrid South project by raising the 275 kV circuits to 500 kV.,SQ-CQ Option 6,• New 500 kV Halys substation with 3 x 500/275 kV 1500 MVA transformers • New 500 kV substations west of Gladstone (CQ 500 kV substation with 3 x 500/275 kV 1500 MVA transformers • New 500 kV substation at Auburn River with 2 x 500/275 kV 1500 MVA transformers • Raise the double-circuit line between Halys and Auburn River substations to 500 kV operation. • Raise the double-circuit line between Auburn River and Gladstone West substations to 500 kV operation • New dynamic reactive support at Gladstone (CQ) west substation,SQ-CQ Option 3,SQ to CQ,350,500,799.58849710968,AEMO TCD,Class 5b(±50%),0,Long: (10 years),Long: (10 years),Long: (10 years)
